{
  "$schema": "https://json-schema.org/draft/2020-12/schema",
  "$id": "https://lexshield.dev/schemas/tool-call-request.schema.json",
  "title": "LexShield ToolCallRequest",
  "description": "Inbound tool call evaluation request. See SPEC §19.",
  "type": "object",
  "required": ["caller", "tool", "arguments", "context"],
  "additionalProperties": false,
  "properties": {
    "id": {
      "type": "string",
      "description": "ULID or UUID; generated if omitted at API boundary"
    },
    "shieldId": {
      "type": "string",
      "description": "Target shield instance id"
    },
    "timestamp": {
      "type": "string",
      "format": "date-time"
    },
    "caller": {
      "$ref": "#/$defs/Caller"
    },
    "tool": {
      "$ref": "#/$defs/ToolRef"
    },
    "arguments": {
      "type": "object",
      "additionalProperties": true,
      "description": "Tool arguments as key-value map"
    },
    "context": {
      "$ref": "#/$defs/CallContext"
    }
  },
  "$defs": {
    "CallerType": {
      "type": "string",
      "enum": ["user", "agent", "service_account"]
    },
    "Caller": {
      "type": "object",
      "required": ["id", "type"],
      "additionalProperties": false,
      "properties": {
        "id": {
          "type": "string",
          "minLength": 1
        },
        "type": {
          "$ref": "#/$defs/CallerType"
        },
        "roles": {
          "type": "array",
          "items": { "type": "string" }
        },
        "metadata": {
          "type": "object",
          "additionalProperties": true
        }
      }
    },
    "ToolRef": {
      "type": "object",
      "required": ["name"],
      "additionalProperties": false,
      "properties": {
        "name": {
          "type": "string",
          "minLength": 1
        },
        "namespace": {
          "type": "string"
        },
        "version": {
          "type": "string"
        }
      }
    },
    "CallContext": {
      "type": "object",
      "additionalProperties": false,
      "properties": {
        "conversationId": {
          "type": "string"
        },
        "messages": {
          "type": "array",
          "items": {
            "type": "object",
            "required": ["role", "content"],
            "additionalProperties": false,
            "properties": {
              "role": { "type": "string" },
              "content": { "type": "string" }
            }
          }
        },
        "priorCalls": {
          "type": "array",
          "items": {
            "$ref": "#/$defs/PriorCall"
          }
        },
        "environment": {
          "type": "string"
        },
        "tags": {
          "type": "object",
          "additionalProperties": { "type": "string" }
        }
      }
    },
    "PriorCall": {
      "type": "object",
      "required": ["timestamp", "tool", "intent", "verdict"],
      "additionalProperties": false,
      "properties": {
        "timestamp": {
          "type": "string",
          "format": "date-time"
        },
        "tool": {
          "$ref": "#/$defs/ToolRef"
        },
        "intent": {
          "type": "string"
        },
        "verdict": {
          "type": "string",
          "enum": ["ALLOW", "BLOCK", "CHALLENGE", "DEFER"]
        }
      }
    }
  }
}
