{
  "id": "01JFIXTUREBLOCKSHELLHI01",
  "shieldId": "local",
  "timestamp": "2026-07-11T12:00:00.000Z",
  "caller": {
    "id": "agent-1",
    "type": "agent"
  },
  "tool": {
    "name": "run_shell"
  },
  "arguments": {
    "command": "rm -rf /tmp/cache"
  },
  "context": {
    "environment": "production"
  }
}
