{
  "id": "01JFIXTUREBLOCKSECRET01",
  "shieldId": "local",
  "timestamp": "2026-07-11T12:00:00.000Z",
  "caller": {
    "id": "agent-1",
    "type": "agent",
    "roles": ["support"]
  },
  "tool": {
    "name": "send_email"
  },
  "arguments": {
    "to": "recipient@example.com",
    "subject": "Status update",
    "body": "Here is the key: AKIAIOSFODNN7EXAMPLE"
  },
  "context": {
    "environment": "production",
    "conversationId": "conv-block-secret-1"
  }
}
