{
  "id": "01JFIXTUREALTERNATIVES01",
  "shieldId": "local",
  "timestamp": "2026-07-11T12:00:00.000Z",
  "caller": {
    "id": "agent-1",
    "type": "agent"
  },
  "tool": {
    "name": "send_email"
  },
  "arguments": {
    "to": "a@b.com",
    "subject": "data",
    "body": "export"
  },
  "context": {
    "environment": "staging"
  }
}
