{
  "id": "01JFIXTUREBLOCKFINANCECHARGE01",
  "shieldId": "local",
  "timestamp": "2026-07-11T12:00:00.000Z",
  "caller": {
    "id": "agent-1",
    "type": "agent"
  },
  "tool": {
    "name": "create_charge"
  },
  "arguments": {
    "customer_id": "cus_123",
    "amount": 4999,
    "currency": "usd"
  },
  "context": {
    "environment": "production"
  }
}
