{
  "id": "01JFIXTUREEXPRESSIONGMAIL01",
  "shieldId": "local",
  "timestamp": "2026-07-11T12:00:00.000Z",
  "caller": {
    "id": "agent-1",
    "type": "agent"
  },
  "tool": {
    "name": "send_email"
  },
  "arguments": {
    "to": "user@gmail.com",
    "subject": "Account notice",
    "body": "Please review your account settings."
  },
  "context": {
    "environment": "production"
  }
}
