{
  "id": "01JFIXTURETAGSMULTIKEY01",
  "shieldId": "local",
  "timestamp": "2026-07-11T12:00:00.000Z",
  "caller": {
    "id": "agent-1",
    "type": "agent"
  },
  "tool": {
    "name": "export_data"
  },
  "arguments": {
    "destination": "s3://external/partner"
  },
  "context": {
    "environment": "production",
    "tags": {
      "data_class": "pii",
      "export_scope": "external"
    }
  }
}
