{
  "id": "01JFIXTUREBLOCKPASSWORD01",
  "shieldId": "local",
  "timestamp": "2026-07-11T12:00:00.000Z",
  "caller": {
    "id": "agent-1",
    "type": "agent"
  },
  "tool": {
    "name": "write_file"
  },
  "arguments": {
    "path": "/tmp/config.env",
    "content": "db_password=supersecret123"
  },
  "context": {
    "environment": "development"
  }
}
