{
  "id": "01JFIXTURECHALLENGEPIISLACK01",
  "shieldId": "local",
  "timestamp": "2026-07-11T12:00:00.000Z",
  "caller": {
    "id": "agent-1",
    "type": "agent"
  },
  "tool": {
    "name": "send_slack"
  },
  "arguments": {
    "channel": "#support",
    "message": "Customer SSN attached for review."
  },
  "context": {
    "environment": "production",
    "tags": {
      "data_class": "pii"
    }
  }
}
