{
  "id": "01JFIXTURECHALWEBHOOK01",
  "shieldId": "local",
  "timestamp": "2026-07-11T12:00:00.000Z",
  "caller": {
    "id": "agent-1",
    "type": "agent"
  },
  "tool": {
    "name": "create_resource"
  },
  "arguments": {
    "type": "database"
  },
  "context": {
    "environment": "staging"
  }
}
