{
  "id": "01JFIXTUREEXPRCOMPLEX01",
  "shieldId": "local",
  "timestamp": "2026-07-11T12:00:00.000Z",
  "caller": {
    "id": "agent-1",
    "type": "agent"
  },
  "tool": {
    "name": "send_email"
  },
  "arguments": {
    "to": "partner@external.com",
    "subject": "Update",
    "body": "Hello"
  },
  "context": {
    "environment": "staging"
  }
}
